bwd_split_autotune.json
[{"key": {"causal": 1, "B": 2, "H": 16, "D": 64, "NQ": 1024, "NK": 1024}, "config": {"BLOCK_SIZE_M": 128, "BLOCK_SIZE_N": 64, "num_warps": 2, "BLOCK_SIZE_M_KV": 128, "BLOCK_SIZE_N_KV": 64, "num_warps_kv": 2, "waves_per_eu": 1}, "ms": 0.3619853973388672, "tflops": 71.19017497790382}, {"key": {"causal": 0, "B": 2, "H": 16, "D": 64, "NQ": 1024, "NK": 1024}, "config": {"BLOCK_SIZE_M": 128, "BLOCK_SIZE_N": 64, "num_warps": 2, "BLOCK_SIZE_M_KV": 128, "BLOCK_SIZE_N_KV": 64, "num_warps_kv": 2, "waves_per_eu": 1}, "ms": 0.3615928411483765, "tflops": 71.26746119795438}, {"key": {"causal": 1, "B": 2, "H": 16, "D": 64, "NQ": 1024, "NK": 2048}, "config": {"BLOCK_SIZE_M": 128, "BLOCK_SIZE_N": 64, "num_warps": 2, "BLOCK_SIZE_M_KV": 128, "BLOCK_SIZE_N_KV": 64, "num_warps_kv": 2, "waves_per_eu": 1}, "ms": 0.42018780708312986, "tflops": 122.6585033720491}, {"key": {"causal": 0, "B": 2, "H": 16, "D": 64, "NQ": 1024, "NK": 2048}, "config": {"BLOCK_SIZE_M": 128, "BLOCK_SIZE_N": 64, "num_warps": 2, "BLOCK_SIZE_M_KV": 128, "BLOCK_SIZE_N_KV": 64, "num_warps_kv": 2, "waves_per_eu": 1}, "ms": 0.36409056186676025, "tflops": 141.5571095491924}, {"key": {"causal": 0, "B": 2, "H": 16, "D": 64, "NQ": 1024, "NK": 4096}, "config": {"BLOCK_SIZE_M": 128, "BLOCK_SIZE_N": 64, "num_warps": 2, "BLOCK_SIZE_M_KV": 128, "BLOCK_SIZE_N_KV": 64, "num_warps_kv": 2, "waves_per_eu": 1}, "ms": 0.5168753623962402, "tflops": 199.42760402841324}, {"key": {"causal": 1, "B": 2, "H": 16, "D": 64, "NQ": 1024, "NK": 8192}, "config": {"BLOCK_SIZE_M": 128, "BLOCK_SIZE_N": 64, "num_warps": 2, "BLOCK_SIZE_M_KV": 128, "BLOCK_SIZE_N_KV": 64, "num_warps_kv": 2, "waves_per_eu": 1}, "ms": 0.9382909774780274, "tflops": 219.7169483203602}, {"key": {"causal": 0, "B": 2, "H": 16, "D": 64, "NQ": 1024, "NK": 8192}, "config": {"BLOCK_SIZE_M": 128, "BLOCK_SIZE_N": 64, "num_warps": 2, "BLOCK_SIZE_M_KV": 128, "BLOCK_SIZE_N_KV": 64, "num_warps_kv": 2, "waves_per_eu": 1}, "ms": 0.7776565551757812, "tflops": 265.102157033062}, {"key": {"causal": 1, "B": 2, "H": 16, "D": 64, "NQ": 2048, "NK": 1024}, "config": {"BLOCK_SIZE_M": 128, "BLOCK_SIZE_N": 64, "num_warps": 2, "BLOCK_SIZE_M_KV": 128, "BLOCK_SIZE_N_KV": 64, "num_warps_kv": 2, "waves_per_eu": 1}, "ms": 0.4574912071228027, "tflops": 112.65704509631244}, {"key": {"causal": 0, "B": 2, "H": 16, "D": 64, "NQ": 2048, "NK": 1024}, "config": {"BLOCK_SIZE_M": 128, "BLOCK_SIZE_N": 64, "num_warps": 2, "BLOCK_SIZE_M_KV": 128, "BLOCK_SIZE_N_KV": 64, "num_warps_kv": 2, "waves_per_eu": 1}, "ms": 0.35858635902404784, "tflops": 143.72997258533084}, {"key": {"causal": 1, "B": 2, "H": 16, "D": 64, "NQ": 2048, "NK": 2048}, "config": {"BLOCK_SIZE_M": 128, "BLOCK_SIZE_N": 64, "num_warps": 2, "BLOCK_SIZE_M_KV": 128, "BLOCK_SIZE_N_KV": 64, "num_warps_kv": 2, "waves_per_eu": 1}, "ms": 0.616815710067749, "tflops": 167.11509357094377}, {"key": {"causal": 0, "B": 2, "H": 16, "D": 64, "NQ": 2048, "NK": 2048}, "config": {"BLOCK_SIZE_M": 128, "BLOCK_SIZE_N": 64, "num_warps": 2, "BLOCK_SIZE_M_KV": 128, "BLOCK_SIZE_N_KV": 64, "num_warps_kv": 2, "waves_per_eu": 1}, "ms": 0.4751574039459229, "tflops": 216.9369860344875}]