bwd_quick_fused_autotune.json
[{"key": {"causal": 0, "B": 16, "H": 16, "D": 128, "NQ": 1024, "NK": 1024}, "config": {"BLOCK_SIZE_M": 64, "BLOCK_SIZE_N": 64, "num_warps": 4, "BLOCK_SIZE_M_KV": 32, "BLOCK_SIZE_N_KV": 64, "num_warps_kv": 4, "waves_per_eu": 2, "num_programs_mult": 2, "fused": true}, "ms": 0.551323652267456, "tflops": 747.8671715248278}, {"key": {"causal": 0, "B": 8, "H": 16, "D": 128, "NQ": 2048, "NK": 2048}, "config": {"BLOCK_SIZE_M": 64, "BLOCK_SIZE_N": 64, "num_warps": 2, "BLOCK_SIZE_M_KV": 64, "BLOCK_SIZE_N_KV": 64, "num_warps_kv": 2, "waves_per_eu": 1, "num_programs_mult": 2, "fused": true}, "ms": 0.8458399772644043, "tflops": 974.9287607556821}, {"key": {"causal": 0, "B": 4, "H": 16, "D": 128, "NQ": 4096, "NK": 4096}, "config": {"BLOCK_SIZE_M": 64, "BLOCK_SIZE_N": 64, "num_warps": 4, "BLOCK_SIZE_M_KV": 64, "BLOCK_SIZE_N_KV": 64, "num_warps_kv": 1, "waves_per_eu": 2, "num_programs_mult": 2, "fused": true}, "ms": 2.2250439325968423, "tflops": 741.2291584459389}, {"key": {"causal": 0, "B": 2, "H": 16, "D": 128, "NQ": 8192, "NK": 8192}, "config": {"BLOCK_SIZE_M": 64, "BLOCK_SIZE_N": 64, "num_warps": 2, "BLOCK_SIZE_M_KV": 64, "BLOCK_SIZE_N_KV": 64, "num_warps_kv": 2, "waves_per_eu": 2, "num_programs_mult": 2, "fused": true}, "ms": 8.075313568115234, "tflops": 408.4714303048263}, {"key": {"causal": 0, "B": 8, "H": 16, "D": 128, "NQ": 1024, "NK": 4096}, "config": {"BLOCK_SIZE_M": 64, "BLOCK_SIZE_N": 64, "num_warps": 2, "BLOCK_SIZE_M_KV": 64, "BLOCK_SIZE_N_KV": 64, "num_warps_kv": 4, "waves_per_eu": 2, "num_programs_mult": 2, "fused": true}, "ms": 0.8617300192515055, "tflops": 956.9513680726509}, {"key": {"causal": 0, "B": 1, "H": 16, "D": 128, "NQ": 4096, "NK": 16384}, "config": {"BLOCK_SIZE_M": 64, "BLOCK_SIZE_N": 64, "num_warps": 2, "BLOCK_SIZE_M_KV": 64, "BLOCK_SIZE_N_KV": 64, "num_warps_kv": 4, "waves_per_eu": 2, "num_programs_mult": 2, "fused": true}, "ms": 7.762449264526367, "tflops": 212.4674037099335}, {"key": {"causal": 0, "B": 2, "H": 48, "D": 128, "NQ": 1024, "NK": 1024}, "config": {"BLOCK_SIZE_M": 64, "BLOCK_SIZE_N": 64, "num_warps": 4, "BLOCK_SIZE_M_KV": 64, "BLOCK_SIZE_N_KV": 64, "num_warps_kv": 4, "waves_per_eu": 2, "num_programs_mult": 2, "fused": true}, "ms": 0.8021086851755778, "tflops": 192.7654263239335}, {"key": {"causal": 0, "B": 2, "H": 48, "D": 128, "NQ": 2048, "NK": 1024}, "config": {"BLOCK_SIZE_M": 64, "BLOCK_SIZE_N": 64, "num_warps": 2, "BLOCK_SIZE_M_KV": 32, "BLOCK_SIZE_N_KV": 64, "num_warps_kv": 1, "waves_per_eu": 2, "num_programs_mult": 2, "fused": true}, "ms": 1.2507200241088867, "tflops": 247.24769680754548}, {"key": {"causal": 0, "B": 2, "H": 48, "D": 128, "NQ": 4096, "NK": 8192}, "config": {"BLOCK_SIZE_M": 64, "BLOCK_SIZE_N": 64, "num_warps": 4, "BLOCK_SIZE_M_KV": 64, "BLOCK_SIZE_N_KV": 64, "num_warps_kv": 4, "waves_per_eu": 2, "num_programs_mult": 2, "fused": true}, "ms": 12.417987823486328, "tflops": 398.4383295685108}, {"key": {"causal": 0, "B": 2, "H": 48, "D": 128, "NQ": 8192, "NK": 4096}, "config": {"BLOCK_SIZE_M": 64, "BLOCK_SIZE_N": 64, "num_warps": 2, "BLOCK_SIZE_M_KV": 64, "BLOCK_SIZE_N_KV": 64, "num_warps_kv": 1, "waves_per_eu": 2, "num_programs_mult": 2, "fused": true}, "ms": 12.970648447672525, "tflops": 381.46144697028177}]