bwd_split_autotune.json
[{"key": {"causal": 0, "B": 2, "H": 16, "D": 64, "NQ": 1024, "NK": 1024}, "config": {"BLOCK_SIZE_M": 128, "BLOCK_SIZE_N": 64, "num_warps": 4, "BLOCK_SIZE_M_KV": 128, "BLOCK_SIZE_N_KV": 64, "num_warps_kv": 2, "waves_per_eu": 1}, "ms": 0.4037614345550537, "tflops": 63.82433182207806}, {"key": {"causal": 0, "B": 2, "H": 16, "D": 64, "NQ": 1024, "NK": 2048}, "config": {"BLOCK_SIZE_M": 128, "BLOCK_SIZE_N": 64, "num_warps": 4, "BLOCK_SIZE_M_KV": 128, "BLOCK_SIZE_N_KV": 64, "num_warps_kv": 4, "waves_per_eu": 1}, "ms": 0.4011575698852539, "tflops": 128.4772154910158}, {"key": {"causal": 0, "B": 2, "H": 16, "D": 64, "NQ": 1024, "NK": 4096}, "config": {"BLOCK_SIZE_M": 128, "BLOCK_SIZE_N": 64, "num_warps": 4, "BLOCK_SIZE_M_KV": 128, "BLOCK_SIZE_N_KV": 64, "num_warps_kv": 2, "waves_per_eu": 1}, "ms": 0.4567280292510986, "tflops": 225.69058280268015}, {"key": {"causal": 0, "B": 2, "H": 16, "D": 64, "NQ": 1024, "NK": 8192}, "config": {"BLOCK_SIZE_M": 128, "BLOCK_SIZE_N": 64, "num_warps": 2, "BLOCK_SIZE_M_KV": 128, "BLOCK_SIZE_N_KV": 64, "num_warps_kv": 2, "waves_per_eu": 1}, "ms": 0.8129408836364747, "tflops": 253.59584486119718}, {"key": {"causal": 0, "B": 2, "H": 16, "D": 64, "NQ": 2048, "NK": 1024}, "config": {"BLOCK_SIZE_M": 128, "BLOCK_SIZE_N": 64, "num_warps": 2, "BLOCK_SIZE_M_KV": 128, "BLOCK_SIZE_N_KV": 64, "num_warps_kv": 2, "waves_per_eu": 1}, "ms": 0.40216503143310545, "tflops": 128.15536788054357}, {"key": {"causal": 0, "B": 2, "H": 16, "D": 64, "NQ": 2048, "NK": 2048}, "config": {"BLOCK_SIZE_M": 128, "BLOCK_SIZE_N": 64, "num_warps": 2, "BLOCK_SIZE_M_KV": 128, "BLOCK_SIZE_N_KV": 64, "num_warps_kv": 2, "waves_per_eu": 1}, "ms": 0.45686025619506837, "tflops": 225.6252622245776}]