bwd_split_autotune.json
[{"key": {"causal": 1, "B": 2, "H": 16, "D": 64, "NQ": 1024, "NK": 1024}, "config": {"BLOCK_SIZE_M": 128, "BLOCK_SIZE_N": 64, "num_warps": 2, "BLOCK_SIZE_M_KV": 128, "BLOCK_SIZE_N_KV": 64, "num_warps_kv": 2, "waves_per_eu": 1, "num_programs_mult": 1}, "ms": 0.36258831024169924, "tflops": 71.07179974672101}, {"key": {"causal": 0, "B": 2, "H": 16, "D": 64, "NQ": 1024, "NK": 1024}, "config": {"BLOCK_SIZE_M": 128, "BLOCK_SIZE_N": 64, "num_warps": 2, "BLOCK_SIZE_M_KV": 128, "BLOCK_SIZE_N_KV": 64, "num_warps_kv": 2, "waves_per_eu": 1, "num_programs_mult": 1}, "ms": 0.3597060441970825, "tflops": 71.64128652194889}, {"key": {"causal": 1, "B": 2, "H": 16, "D": 64, "NQ": 1024, "NK": 2048}, "config": {"BLOCK_SIZE_M": 128, "BLOCK_SIZE_N": 64, "num_warps": 2, "BLOCK_SIZE_M_KV": 128, "BLOCK_SIZE_N_KV": 64, "num_warps_kv": 2, "waves_per_eu": 1, "num_programs_mult": 2}, "ms": 0.375495457649231, "tflops": 137.25760592328047}, {"key": {"causal": 0, "B": 2, "H": 16, "D": 64, "NQ": 1024, "NK": 2048}, "config": {"BLOCK_SIZE_M": 128, "BLOCK_SIZE_N": 64, "num_warps": 2, "BLOCK_SIZE_M_KV": 128, "BLOCK_SIZE_N_KV": 64, "num_warps_kv": 2, "waves_per_eu": 1, "num_programs_mult": 2}, "ms": 0.3568437576293945, "tflops": 144.43185974273715}, {"key": {"causal": 1, "B": 2, "H": 16, "D": 64, "NQ": 1024, "NK": 4096}, "config": {"BLOCK_SIZE_M": 128, "BLOCK_SIZE_N": 64, "num_warps": 2, "BLOCK_SIZE_M_KV": 128, "BLOCK_SIZE_N_KV": 64, "num_warps_kv": 2, "waves_per_eu": 1, "num_programs_mult": 2}, "ms": 0.5482639312744141, "tflops": 188.0102068075081}, {"key": {"causal": 0, "B": 2, "H": 16, "D": 64, "NQ": 1024, "NK": 4096}, "config": {"BLOCK_SIZE_M": 128, "BLOCK_SIZE_N": 64, "num_warps": 2, "BLOCK_SIZE_M_KV": 128, "BLOCK_SIZE_N_KV": 64, "num_warps_kv": 2, "waves_per_eu": 1, "num_programs_mult": 2}, "ms": 0.3697669506072998, "tflops": 278.76805900231}, {"key": {"causal": 1, "B": 2, "H": 16, "D": 64, "NQ": 1024, "NK": 8192}, "config": {"BLOCK_SIZE_M": 128, "BLOCK_SIZE_N": 64, "num_warps": 2, "BLOCK_SIZE_M_KV": 128, "BLOCK_SIZE_N_KV": 64, "num_warps_kv": 2, "waves_per_eu": 1, "num_programs_mult": 2}, "ms": 0.8854825973510743, "tflops": 232.82041998874288}, {"key": {"causal": 0, "B": 2, "H": 16, "D": 64, "NQ": 1024, "NK": 8192}, "config": {"BLOCK_SIZE_M": 128, "BLOCK_SIZE_N": 64, "num_warps": 2, "BLOCK_SIZE_M_KV": 128, "BLOCK_SIZE_N_KV": 64, "num_warps_kv": 2, "waves_per_eu": 1, "num_programs_mult": 2}, "ms": 0.7055334568023681, "tflops": 292.2022027734235}, {"key": {"causal": 1, "B": 2, "H": 16, "D": 64, "NQ": 2048, "NK": 1024}, "config": {"BLOCK_SIZE_M": 128, "BLOCK_SIZE_N": 64, "num_warps": 2, "BLOCK_SIZE_M_KV": 128, "BLOCK_SIZE_N_KV": 64, "num_warps_kv": 2, "waves_per_eu": 1, "num_programs_mult": 2}, "ms": 0.44224853515625, "tflops": 116.53991693559965}, {"key": {"causal": 0, "B": 2, "H": 16, "D": 64, "NQ": 2048, "NK": 1024}, "config": {"BLOCK_SIZE_M": 128, "BLOCK_SIZE_N": 64, "num_warps": 2, "BLOCK_SIZE_M_KV": 128, "BLOCK_SIZE_N_KV": 64, "num_warps_kv": 2, "waves_per_eu": 1, "num_programs_mult": 2}, "ms": 0.36319520473480227, "tflops": 141.9060793757813}, {"key": {"causal": 1, "B": 2, "H": 16, "D": 64, "NQ": 2048, "NK": 2048}, "config": {"BLOCK_SIZE_M": 128, "BLOCK_SIZE_N": 64, "num_warps": 2, "BLOCK_SIZE_M_KV": 128, "BLOCK_SIZE_N_KV": 64, "num_warps_kv": 2, "waves_per_eu": 1, "num_programs_mult": 2}, "ms": 0.5077598571777344, "tflops": 203.00780703094952}, {"key": {"causal": 0, "B": 2, "H": 16, "D": 64, "NQ": 2048, "NK": 2048}, "config": {"BLOCK_SIZE_M": 128, "BLOCK_SIZE_N": 64, "num_warps": 2, "BLOCK_SIZE_M_KV": 128, "BLOCK_SIZE_N_KV": 64, "num_warps_kv": 2, "waves_per_eu": 1, "num_programs_mult": 2}, "ms": 0.36606149673461913, "tflops": 281.5898859167059}]