la_configs/flash_configs/bwd_flash.json
[{"key": {"causal": 0, "B": 16, "H": 16, "D": 128, "NQ": 1024, "NK": 1024}, "config": {"BLOCK_M1": 32, "BLOCK_N1": 128, "BLOCK_M2": 64, "BLOCK_N2": 64, "BLK_SLICE_FACTOR": 2, "num_warps": 4, "num_ctas": 1, "num_stages": 1}, "ms": 1.6705859502156575, "tflops": 246.80972587059867}, {"key": {"causal": 0, "B": 8, "H": 16, "D": 128, "NQ": 2048, "NK": 2048}, "config": {"BLOCK_M1": 32, "BLOCK_N1": 128, "BLOCK_M2": 64, "BLOCK_N2": 64, "BLK_SLICE_FACTOR": 2, "num_warps": 4, "num_ctas": 1, "num_stages": 1}, "ms": 2.8839070002237954, "tflops": 285.9432432349612}, {"key": {"causal": 0, "B": 4, "H": 16, "D": 128, "NQ": 4096, "NK": 4096}, "config": {"BLOCK_M1": 32, "BLOCK_N1": 128, "BLOCK_M2": 64, "BLOCK_N2": 64, "BLK_SLICE_FACTOR": 2, "num_warps": 4, "num_ctas": 1, "num_stages": 1}, "ms": 5.6129576365153, "tflops": 293.8321556062763}, {"key": {"causal": 0, "B": 2, "H": 16, "D": 128, "NQ": 8192, "NK": 8192}, "config": {"BLOCK_M1": 32, "BLOCK_N1": 128, "BLOCK_M2": 64, "BLOCK_N2": 64, "BLK_SLICE_FACTOR": 2, "num_warps": 4, "num_ctas": 1, "num_stages": 1}, "ms": 10.936752319335938, "tflops": 301.6009494423919}, {"key": {"causal": 0, "B": 2, "H": 48, "D": 128, "NQ": 1024, "NK": 1024}, "config": {"BLOCK_M1": 32, "BLOCK_N1": 128, "BLOCK_M2": 64, "BLOCK_N2": 64, "BLK_SLICE_FACTOR": 2, "num_warps": 4, "num_ctas": 1, "num_stages": 1}, "ms": 0.8719743092854818, "tflops": 177.32038777919803}, {"key": {"causal": 0, "B": 2, "H": 48, "D": 128, "NQ": 2048, "NK": 1024}, "config": {"BLOCK_M1": 32, "BLOCK_N1": 128, "BLOCK_M2": 64, "BLOCK_N2": 64, "BLK_SLICE_FACTOR": 2, "num_warps": 4, "num_ctas": 1, "num_stages": 1}, "ms": 1.3357426325480144, "tflops": 231.50990151606484}, {"key": {"causal": 0, "B": 2, "H": 48, "D": 128, "NQ": 4096, "NK": 8192}, "config": {"BLOCK_M1": 32, "BLOCK_N1": 64, "BLOCK_M2": 128, "BLOCK_N2": 32, "BLK_SLICE_FACTOR": 2, "num_warps": 2, "num_ctas": 1, "num_stages": 1}, "ms": 19.022459665934246, "tflops": 260.1031839143605}, {"key": {"causal": 0, "B": 2, "H": 48, "D": 128, "NQ": 8192, "NK": 4096}, "config": {"BLOCK_M1": 32, "BLOCK_N1": 128, "BLOCK_M2": 64, "BLOCK_N2": 64, "BLK_SLICE_FACTOR": 2, "num_warps": 4, "num_ctas": 1, "num_stages": 1}, "ms": 16.32029088338216, "tflops": 303.1687584704761}, {"key": {"causal": 0, "B": 2, "H": 16, "D": 128, "NQ": 16384, "NK": 16384}, "config": {"BLOCK_M1": 32, "BLOCK_N1": 128, "BLOCK_M2": 64, "BLOCK_N2": 64, "BLK_SLICE_FACTOR": 2, "num_warps": 4, "num_ctas": 1, "num_stages": 1}, "ms": 44.32142639160156, "tflops": 297.6921233702025}, {"key": {"causal": 0, "B": 2, "H": 16, "D": 128, "NQ": 32768, "NK": 32768}, "config": {"BLOCK_M1": 32, "BLOCK_N1": 128, "BLOCK_M2": 64, "BLOCK_N2": 64, "BLK_SLICE_FACTOR": 2, "num_warps": 4, "num_ctas": 1, "num_stages": 1}, "ms": 173.77079264322916, "tflops": 303.7136294912584}, {"key": {"causal": 0, "B": 2, "H": 16, "D": 128, "NQ": 16384, "NK": 8192}, "config": {"BLOCK_M1": 32, "BLOCK_N1": 128, "BLOCK_M2": 64, "BLOCK_N2": 64, "BLK_SLICE_FACTOR": 2, "num_warps": 4, "num_ctas": 1, "num_stages": 1}, "ms": 21.589698791503906, "tflops": 305.56562323380416}, {"key": {"causal": 0, "B": 1, "H": 16, "D": 128, "NQ": 4096, "NK": 16384}, "config": {"BLOCK_M1": 32, "BLOCK_N1": 64, "BLOCK_M2": 128, "BLOCK_N2": 32, "BLK_SLICE_FACTOR": 2, "num_warps": 2, "num_ctas": 1, "num_stages": 1}, "ms": 6.73281987508138, "tflops": 244.95938882429485}, {"key": {"causal": 0, "B": 2, "H": 16, "D": 128, "NQ": 16384, "NK": 32768}, "config": {"BLOCK_M1": 32, "BLOCK_N1": 64, "BLOCK_M2": 128, "BLOCK_N2": 32, "BLK_SLICE_FACTOR": 2, "num_warps": 2, "num_ctas": 1, "num_stages": 1}, "ms": 97.5799051920573, "tflops": 270.42738988817877}]