la_configs/beatfused535814.json
[{"key": {"causal": 0, "B": 1, "H": 16, "D": 128, "NQ": 1024, "NK": 1024}, "config": {"BLOCK_SIZE_M": 64, "BLOCK_SIZE_N": 64, "num_warps": 2, "BLOCK_SIZE_M_KV": 32, "BLOCK_SIZE_N_KV": 64, "num_warps_kv": 2, "waves_per_eu": 1, "num_programs_mult": 2}, "ms": 0.3659347057342529, "tflops": 70.42186316898405}, {"key": {"causal": 0, "B": 1, "H": 16, "D": 128, "NQ": 1024, "NK": 2048}, "config": {"BLOCK_SIZE_M": 64, "BLOCK_SIZE_N": 64, "num_warps": 2, "BLOCK_SIZE_M_KV": 32, "BLOCK_SIZE_N_KV": 64, "num_warps_kv": 2, "waves_per_eu": 1, "num_programs_mult": 2}, "ms": 0.477740478515625, "tflops": 107.88201935941743}, {"key": {"causal": 0, "B": 1, "H": 16, "D": 128, "NQ": 1024, "NK": 4096}, "config": {"BLOCK_SIZE_M": 64, "BLOCK_SIZE_N": 64, "num_warps": 2, "BLOCK_SIZE_M_KV": 32, "BLOCK_SIZE_N_KV": 64, "num_warps_kv": 2, "waves_per_eu": 1, "num_programs_mult": 2}, "ms": 0.7861298084259033, "tflops": 131.12238462296617}, {"key": {"causal": 0, "B": 1, "H": 16, "D": 128, "NQ": 1024, "NK": 8192}, "config": {"BLOCK_SIZE_M": 64, "BLOCK_SIZE_N": 64, "num_warps": 2, "BLOCK_SIZE_M_KV": 32, "BLOCK_SIZE_N_KV": 64, "num_warps_kv": 2, "waves_per_eu": 1, "num_programs_mult": 2}, "ms": 1.4118098258972167, "tflops": 146.02422112835532}, {"key": {"causal": 0, "B": 1, "H": 16, "D": 128, "NQ": 2048, "NK": 1024}, "config": {"BLOCK_SIZE_M": 64, "BLOCK_SIZE_N": 64, "num_warps": 2, "BLOCK_SIZE_M_KV": 32, "BLOCK_SIZE_N_KV": 64, "num_warps_kv": 2, "waves_per_eu": 1, "num_programs_mult": 2}, "ms": 0.5067034721374511, "tflops": 101.71552078494359}, {"key": {"causal": 0, "B": 1, "H": 16, "D": 128, "NQ": 2048, "NK": 2048}, "config": {"BLOCK_SIZE_M": 64, "BLOCK_SIZE_N": 64, "num_warps": 2, "BLOCK_SIZE_M_KV": 32, "BLOCK_SIZE_N_KV": 64, "num_warps_kv": 2, "waves_per_eu": 1, "num_programs_mult": 2}, "ms": 0.6614669799804688, "tflops": 155.83425662010163}, {"key": {"causal": 0, "B": 1, "H": 16, "D": 128, "NQ": 2048, "NK": 4096}, "config": {"BLOCK_SIZE_M": 64, "BLOCK_SIZE_N": 64, "num_warps": 2, "BLOCK_SIZE_M_KV": 32, "BLOCK_SIZE_N_KV": 64, "num_warps_kv": 2, "waves_per_eu": 1, "num_programs_mult": 2}, "ms": 1.1027713775634767, "tflops": 186.94575720989215}, {"key": {"causal": 0, "B": 1, "H": 16, "D": 128, "NQ": 2048, "NK": 8192}, "config": {"BLOCK_SIZE_M": 64, "BLOCK_SIZE_N": 64, "num_warps": 2, "BLOCK_SIZE_M_KV": 32, "BLOCK_SIZE_N_KV": 64, "num_warps_kv": 2, "waves_per_eu": 1, "num_programs_mult": 2}, "ms": 2.0293094635009767, "tflops": 203.1808690748766}, {"key": {"causal": 0, "B": 1, "H": 16, "D": 128, "NQ": 4096, "NK": 1024}, "config": {"BLOCK_SIZE_M": 64, "BLOCK_SIZE_N": 64, "num_warps": 2, "BLOCK_SIZE_M_KV": 32, "BLOCK_SIZE_N_KV": 64, "num_warps_kv": 2, "waves_per_eu": 1, "num_programs_mult": 2}, "ms": 0.8795864105224609, "tflops": 117.19054986624056}, {"key": {"causal": 0, "B": 1, "H": 16, "D": 128, "NQ": 4096, "NK": 2048}, "config": {"BLOCK_SIZE_M": 64, "BLOCK_SIZE_N": 64, "num_warps": 2, "BLOCK_SIZE_M_KV": 32, "BLOCK_SIZE_N_KV": 64, "num_warps_kv": 2, "waves_per_eu": 1, "num_programs_mult": 2}, "ms": 1.2047606468200684, "tflops": 171.11982430049432}, {"key": {"causal": 0, "B": 1, "H": 16, "D": 128, "NQ": 4096, "NK": 4096}, "config": {"BLOCK_SIZE_M": 64, "BLOCK_SIZE_N": 64, "num_warps": 2, "BLOCK_SIZE_M_KV": 32, "BLOCK_SIZE_N_KV": 64, "num_warps_kv": 2, "waves_per_eu": 1, "num_programs_mult": 2}, "ms": 2.299406051635742, "tflops": 179.31450607546574}, {"key": {"causal": 0, "B": 1, "H": 16, "D": 128, "NQ": 4096, "NK": 8192}, "config": {"BLOCK_SIZE_M": 64, "BLOCK_SIZE_N": 64, "num_warps": 2, "BLOCK_SIZE_M_KV": 32, "BLOCK_SIZE_N_KV": 64, "num_warps_kv": 2, "waves_per_eu": 1, "num_programs_mult": 2}, "ms": 4.512840652465821, "tflops": 182.7305203833021}, {"key": {"causal": 0, "B": 1, "H": 16, "D": 128, "NQ": 8192, "NK": 1024}, "config": {"BLOCK_SIZE_M": 64, "BLOCK_SIZE_N": 64, "num_warps": 2, "BLOCK_SIZE_M_KV": 32, "BLOCK_SIZE_N_KV": 64, "num_warps_kv": 2, "waves_per_eu": 1, "num_programs_mult": 2}, "ms": 1.5802234649658202, "tflops": 130.46156747992546}, {"key": {"causal": 0, "B": 1, "H": 16, "D": 128, "NQ": 8192, "NK": 2048}, "config": {"BLOCK_SIZE_M": 64, "BLOCK_SIZE_N": 64, "num_warps": 2, "BLOCK_SIZE_M_KV": 32, "BLOCK_SIZE_N_KV": 64, "num_warps_kv": 2, "waves_per_eu": 1, "num_programs_mult": 2}, "ms": 2.2301351547241213, "tflops": 184.88424772937387}, {"key": {"causal": 0, "B": 1, "H": 16, "D": 128, "NQ": 8192, "NK": 4096}, "config": {"BLOCK_SIZE_M": 64, "BLOCK_SIZE_N": 64, "num_warps": 2, "BLOCK_SIZE_M_KV": 32, "BLOCK_SIZE_N_KV": 64, "num_warps_kv": 2, "waves_per_eu": 1, "num_programs_mult": 2}, "ms": 4.464098358154297, "tflops": 184.72570599294517}, {"key": {"causal": 0, "B": 1, "H": 16, "D": 128, "NQ": 8192, "NK": 8192}, "config": {"BLOCK_SIZE_M": 64, "BLOCK_SIZE_N": 64, "num_warps": 2, "BLOCK_SIZE_M_KV": 32, "BLOCK_SIZE_N_KV": 64, "num_warps_kv": 2, "waves_per_eu": 1, "num_programs_mult": 2}, "ms": 9.23020248413086, "tflops": 178.68161012713682}, {"key": {"causal": 0, "B": 1, "H": 48, "D": 128, "NQ": 1024, "NK": 1024}, "config": {"BLOCK_SIZE_M": 64, "BLOCK_SIZE_N": 64, "num_warps": 2, "BLOCK_SIZE_M_KV": 32, "BLOCK_SIZE_N_KV": 64, "num_warps_kv": 2, "waves_per_eu": 1, "num_programs_mult": 2}, "ms": 0.7289229393005371, "tflops": 106.05978651486107}, {"key": {"causal": 0, "B": 1, "H": 48, "D": 128, "NQ": 1024, "NK": 2048}, "config": {"BLOCK_SIZE_M": 64, "BLOCK_SIZE_N": 64, "num_warps": 2, "BLOCK_SIZE_M_KV": 32, "BLOCK_SIZE_N_KV": 64, "num_warps_kv": 2, "waves_per_eu": 1, "num_programs_mult": 2}, "ms": 1.1580554008483888, "tflops": 133.5159117108962}, {"key": {"causal": 0, "B": 1, "H": 48, "D": 128, "NQ": 1024, "NK": 4096}, "config": {"BLOCK_SIZE_M": 64, "BLOCK_SIZE_N": 64, "num_warps": 2, "BLOCK_SIZE_M_KV": 32, "BLOCK_SIZE_N_KV": 64, "num_warps_kv": 2, "waves_per_eu": 1, "num_programs_mult": 2}, "ms": 2.098866653442383, "tflops": 147.33553692170707}, {"key": {"causal": 0, "B": 1, "H": 48, "D": 128, "NQ": 1024, "NK": 8192}, "config": {"BLOCK_SIZE_M": 64, "BLOCK_SIZE_N": 64, "num_warps": 2, "BLOCK_SIZE_M_KV": 32, "BLOCK_SIZE_N_KV": 64, "num_warps_kv": 2, "waves_per_eu": 1, "num_programs_mult": 2}, "ms": 3.9406761169433593, "tflops": 156.94649148271768}]