la_configs/bwd_third_agg.json
[{"key": {"causal": 0, "B": 16, "H": 16, "D": 128, "NQ": 1024, "NK": 1024}, "config": {"BLOCK_SIZE_M": 64, "BLOCK_SIZE_N": 64, "num_warps": 4, "BLOCK_SIZE_M_KV": 32, "BLOCK_SIZE_N_KV": 128, "num_warps_kv": 4, "waves_per_eu": 1, "num_programs_mult": 5, "fused": true, "prefetch_qt": 2, "prefetch_kv": 2, "num_stages": 1}, "ms": 0.7040850321451823, "tflops": 585.6066264606804}, {"key": {"causal": 0, "B": 8, "H": 16, "D": 128, "NQ": 2048, "NK": 2048}, "config": {"BLOCK_SIZE_M": 64, "BLOCK_SIZE_N": 64, "num_warps": 4, "BLOCK_SIZE_M_KV": 32, "BLOCK_SIZE_N_KV": 128, "num_warps_kv": 4, "waves_per_eu": 1, "num_programs_mult": 4, "fused": true, "prefetch_qt": 2, "prefetch_kv": 2, "num_stages": 1}, "ms": 1.167119026184082, "tflops": 706.5549462664109}, {"key": {"causal": 0, "B": 4, "H": 16, "D": 128, "NQ": 4096, "NK": 4096}, "config": {"BLOCK_SIZE_M": 64, "BLOCK_SIZE_N": 64, "num_warps": 4, "BLOCK_SIZE_M_KV": 32, "BLOCK_SIZE_N_KV": 128, "num_warps_kv": 4, "waves_per_eu": 1, "num_programs_mult": 5, "fused": true, "prefetch_qt": 2, "prefetch_kv": 2, "num_stages": 1}, "ms": 2.928546587626139, "tflops": 563.1692692315629}, {"key": {"causal": 0, "B": 2, "H": 16, "D": 128, "NQ": 8192, "NK": 8192}, "config": {"BLOCK_SIZE_M": 64, "BLOCK_SIZE_N": 64, "num_warps": 4, "BLOCK_SIZE_M_KV": 32, "BLOCK_SIZE_N_KV": 128, "num_warps_kv": 4, "waves_per_eu": 1, "num_programs_mult": 5, "fused": true, "prefetch_qt": 2, "prefetch_kv": 2, "num_stages": 1}, "ms": 10.297363917032877, "tflops": 320.3280868681247}, {"key": {"causal": 0, "B": 2, "H": 48, "D": 128, "NQ": 1024, "NK": 1024}, "config": {"BLOCK_SIZE_M": 64, "BLOCK_SIZE_N": 64, "num_warps": 4, "BLOCK_SIZE_M_KV": 32, "BLOCK_SIZE_N_KV": 128, "num_warps_kv": 4, "waves_per_eu": 1, "num_programs_mult": 5, "fused": true, "prefetch_qt": 2, "prefetch_kv": 2, "num_stages": 1}, "ms": 1.0596396923065186, "tflops": 145.91641270009535}, {"key": {"causal": 0, "B": 2, "H": 48, "D": 128, "NQ": 2048, "NK": 1024}, "config": {"BLOCK_SIZE_M": 64, "BLOCK_SIZE_N": 64, "num_warps": 4, "BLOCK_SIZE_M_KV": 32, "BLOCK_SIZE_N_KV": 128, "num_warps_kv": 4, "waves_per_eu": 1, "num_programs_mult": 5, "fused": true, "prefetch_qt": 2, "prefetch_kv": 2, "num_stages": 1}, "ms": 1.4992787043253581, "tflops": 206.2576120236097}, {"key": {"causal": 0, "B": 2, "H": 48, "D": 128, "NQ": 4096, "NK": 8192}, "config": {"BLOCK_SIZE_M": 64, "BLOCK_SIZE_N": 64, "num_warps": 4, "BLOCK_SIZE_M_KV": 32, "BLOCK_SIZE_N_KV": 128, "num_warps_kv": 4, "waves_per_eu": 1, "num_programs_mult": 3, "fused": true, "prefetch_qt": 2, "prefetch_kv": 2, "num_stages": 1}, "ms": 16.109830220540363, "tflops": 307.1293897736707}, {"key": {"causal": 0, "B": 2, "H": 48, "D": 128, "NQ": 8192, "NK": 4096}, "config": {"BLOCK_SIZE_M": 64, "BLOCK_SIZE_N": 64, "num_warps": 4, "BLOCK_SIZE_M_KV": 32, "BLOCK_SIZE_N_KV": 128, "num_warps_kv": 4, "waves_per_eu": 1, "num_programs_mult": 3, "fused": true, "prefetch_qt": 2, "prefetch_kv": 2, "num_stages": 1}, "ms": 16.912782033284504, "tflops": 292.5481044605601}, {"key": {"causal": 0, "B": 2, "H": 16, "D": 128, "NQ": 16384, "NK": 16384}, "config": {"BLOCK_SIZE_M": 64, "BLOCK_SIZE_N": 64, "num_warps": 4, "BLOCK_SIZE_M_KV": 32, "BLOCK_SIZE_N_KV": 128, "num_warps_kv": 4, "waves_per_eu": 1, "num_programs_mult": 3, "fused": true, "prefetch_qt": 2, "prefetch_kv": 2, "num_stages": 1}, "ms": 40.01030476888021, "tflops": 329.76853361972707}, {"key": {"causal": 0, "B": 2, "H": 16, "D": 128, "NQ": 16384, "NK": 8192}, "config": {"BLOCK_SIZE_M": 64, "BLOCK_SIZE_N": 64, "num_warps": 4, "BLOCK_SIZE_M_KV": 32, "BLOCK_SIZE_N_KV": 128, "num_warps_kv": 4, "waves_per_eu": 1, "num_programs_mult": 5, "fused": true, "prefetch_qt": 2, "prefetch_kv": 2, "num_stages": 1}, "ms": 21.246615091959637, "tflops": 310.49980140848555}, {"key": {"causal": 0, "B": 1, "H": 16, "D": 128, "NQ": 4096, "NK": 16384}, "config": {"BLOCK_SIZE_M": 64, "BLOCK_SIZE_N": 64, "num_warps": 4, "BLOCK_SIZE_M_KV": 32, "BLOCK_SIZE_N_KV": 128, "num_warps_kv": 4, "waves_per_eu": 1, "num_programs_mult": 5, "fused": true, "prefetch_qt": 2, "prefetch_kv": 2, "num_stages": 1}, "ms": 10.42408561706543, "tflops": 158.21698921620128}, {"key": {"causal": 0, "B": 2, "H": 16, "D": 128, "NQ": 16384, "NK": 32768}, "config": {"BLOCK_SIZE_M": 64, "BLOCK_SIZE_N": 64, "num_warps": 4, "BLOCK_SIZE_M_KV": 32, "BLOCK_SIZE_N_KV": 128, "num_warps_kv": 4, "waves_per_eu": 1, "num_programs_mult": 5, "fused": true, "prefetch_qt": 2, "prefetch_kv": 2, "num_stages": 1}, "ms": 78.16210428873698, "tflops": 337.60962945858796}, {"key": {"causal": 0, "B": 2, "H": 48, "D": 128, "NQ": 16384, "NK": 8192}, "config": {"BLOCK_SIZE_M": 64, "BLOCK_SIZE_N": 64, "num_warps": 4, "BLOCK_SIZE_M_KV": 32, "BLOCK_SIZE_N_KV": 128, "num_warps_kv": 4, "waves_per_eu": 1, "num_programs_mult": 3, "fused": true, "prefetch_qt": 2, "prefetch_kv": 2, "num_stages": 1}, "ms": 62.5210215250651, "tflops": 316.55287801133534}, {"key": {"causal": 0, "B": 1, "H": 48, "D": 128, "NQ": 4096, "NK": 16384}, "config": {"BLOCK_SIZE_M": 64, "BLOCK_SIZE_N": 64, "num_warps": 4, "BLOCK_SIZE_M_KV": 32, "BLOCK_SIZE_N_KV": 128, "num_warps_kv": 4, "waves_per_eu": 1, "num_programs_mult": 3, "fused": true, "prefetch_qt": 2, "prefetch_kv": 2, "num_stages": 1}, "ms": 30.98863474527995, "tflops": 159.66506319693957}, {"key": {"causal": 0, "B": 2, "H": 48, "D": 128, "NQ": 128, "NK": 8192}, "config": {"BLOCK_SIZE_M": 64, "BLOCK_SIZE_N": 64, "num_warps": 4, "BLOCK_SIZE_M_KV": 32, "BLOCK_SIZE_N_KV": 128, "num_warps_kv": 4, "waves_per_eu": 1, "num_programs_mult": 5, "fused": true, "prefetch_qt": 2, "prefetch_kv": 2, "num_stages": 1}, "ms": 1.2111709912618, "tflops": 127.66060595202818}, {"key": {"causal": 0, "B": 2, "H": 48, "D": 128, "NQ": 128, "NK": 4096}, "config": {"BLOCK_SIZE_M": 64, "BLOCK_SIZE_N": 64, "num_warps": 4, "BLOCK_SIZE_M_KV": 32, "BLOCK_SIZE_N_KV": 128, "num_warps_kv": 4, "waves_per_eu": 1, "num_programs_mult": 5, "fused": true, "prefetch_qt": 2, "prefetch_kv": 2, "num_stages": 1}, "ms": 0.8308599789937338, "tflops": 93.04746080275827}, {"key": {"causal": 0, "B": 2, "H": 48, "D": 128, "NQ": 128, "NK": 1024}, "config": {"BLOCK_SIZE_M": 64, "BLOCK_SIZE_N": 64, "num_warps": 4, "BLOCK_SIZE_M_KV": 32, "BLOCK_SIZE_N_KV": 128, "num_warps_kv": 4, "waves_per_eu": 1, "num_programs_mult": 4, "fused": true, "prefetch_qt": 2, "prefetch_kv": 2, "num_stages": 1}, "ms": 0.5805416504542033, "tflops": 33.2919314520822}, {"key": {"causal": 0, "B": 2, "H": 48, "D": 128, "NQ": 128, "NK": 2048}, "config": {"BLOCK_SIZE_M": 64, "BLOCK_SIZE_N": 64, "num_warps": 4, "BLOCK_SIZE_M_KV": 32, "BLOCK_SIZE_N_KV": 128, "num_warps_kv": 4, "waves_per_eu": 1, "num_programs_mult": 3, "fused": true, "prefetch_qt": 2, "prefetch_kv": 2, "num_stages": 1}, "ms": 0.6686189969380697, "tflops": 57.81275411111354}]