la_configs/bwd_redo.json
[{"key": {"causal": 0, "B": 16, "H": 16, "D": 128, "NQ": 1024, "NK": 1024}, "config": {"BLOCK_SIZE_M": 64, "BLOCK_SIZE_N": 128, "num_warps": 4, "BLOCK_SIZE_M_KV": 32, "BLOCK_SIZE_N_KV": 64, "num_warps_kv": 4, "waves_per_eu": 1, "num_programs_mult": 2, "fused": true, "prefetch_qt": 2, "prefetch_kv": 2, "num_stages": 1}, "ms": 0.8409949938456217, "tflops": 490.27266919936915}, {"key": {"causal": 0, "B": 8, "H": 16, "D": 128, "NQ": 2048, "NK": 2048}, "config": {"BLOCK_SIZE_M": 128, "BLOCK_SIZE_N": 128, "num_warps": 4, "BLOCK_SIZE_M_KV": 64, "BLOCK_SIZE_N_KV": 128, "num_warps_kv": 4, "waves_per_eu": 1, "num_programs_mult": 2, "fused": true, "prefetch_qt": 2, "prefetch_kv": 2, "num_stages": 1}, "ms": 1.1592406431833904, "tflops": 711.3568055787567}, {"key": {"causal": 0, "B": 4, "H": 16, "D": 128, "NQ": 4096, "NK": 4096}, "config": {"BLOCK_SIZE_M": 128, "BLOCK_SIZE_N": 128, "num_warps": 4, "BLOCK_SIZE_M_KV": 64, "BLOCK_SIZE_N_KV": 128, "num_warps_kv": 4, "waves_per_eu": 1, "num_programs_mult": 2, "fused": true, "prefetch_qt": 2, "prefetch_kv": 2, "num_stages": 1}, "ms": 2.2178522745768228, "tflops": 743.6326849039973}, {"key": {"causal": 0, "B": 2, "H": 16, "D": 128, "NQ": 8192, "NK": 8192}, "config": {"BLOCK_SIZE_M": 128, "BLOCK_SIZE_N": 128, "num_warps": 4, "BLOCK_SIZE_M_KV": 64, "BLOCK_SIZE_N_KV": 128, "num_warps_kv": 4, "waves_per_eu": 1, "num_programs_mult": 2, "fused": true, "prefetch_qt": 2, "prefetch_kv": 2, "num_stages": 1}, "ms": 7.39585812886556, "tflops": 445.99758754890524}, {"key": {"causal": 0, "B": 2, "H": 48, "D": 128, "NQ": 1024, "NK": 1024}, "config": {"BLOCK_SIZE_M": 128, "BLOCK_SIZE_N": 128, "num_warps": 4, "BLOCK_SIZE_M_KV": 64, "BLOCK_SIZE_N_KV": 128, "num_warps_kv": 4, "waves_per_eu": 1, "num_programs_mult": 2, "fused": true, "prefetch_qt": 2, "prefetch_kv": 2, "num_stages": 1}, "ms": 1.0658620198567708, "tflops": 145.06457662951297}, {"key": {"causal": 0, "B": 2, "H": 48, "D": 128, "NQ": 2048, "NK": 1024}, "config": {"BLOCK_SIZE_M": 128, "BLOCK_SIZE_N": 128, "num_warps": 4, "BLOCK_SIZE_M_KV": 64, "BLOCK_SIZE_N_KV": 128, "num_warps_kv": 4, "waves_per_eu": 1, "num_programs_mult": 2, "fused": true, "prefetch_qt": 2, "prefetch_kv": 2, "num_stages": 1}, "ms": 1.4703826904296875, "tflops": 210.31099408660202}, {"key": {"causal": 0, "B": 2, "H": 48, "D": 128, "NQ": 4096, "NK": 8192}, "config": {"BLOCK_SIZE_M": 128, "BLOCK_SIZE_N": 128, "num_warps": 4, "BLOCK_SIZE_M_KV": 64, "BLOCK_SIZE_N_KV": 128, "num_warps_kv": 4, "waves_per_eu": 1, "num_programs_mult": 2, "fused": true, "prefetch_qt": 2, "prefetch_kv": 2, "num_stages": 1}, "ms": 10.54861831665039, "tflops": 469.0474312813249}, {"key": {"causal": 0, "B": 2, "H": 48, "D": 128, "NQ": 8192, "NK": 4096}, "config": {"BLOCK_SIZE_M": 128, "BLOCK_SIZE_N": 128, "num_warps": 4, "BLOCK_SIZE_M_KV": 64, "BLOCK_SIZE_N_KV": 128, "num_warps_kv": 4, "waves_per_eu": 1, "num_programs_mult": 2, "fused": true, "prefetch_qt": 2, "prefetch_kv": 2, "num_stages": 1}, "ms": 10.810860951741537, "tflops": 457.6695923736723}, {"key": {"causal": 0, "B": 2, "H": 16, "D": 128, "NQ": 16384, "NK": 16384}, "config": {"BLOCK_SIZE_M": 128, "BLOCK_SIZE_N": 128, "num_warps": 4, "BLOCK_SIZE_M_KV": 64, "BLOCK_SIZE_N_KV": 128, "num_warps_kv": 4, "waves_per_eu": 1, "num_programs_mult": 2, "fused": true, "prefetch_qt": 2, "prefetch_kv": 2, "num_stages": 1}, "ms": 24.246175130208332, "tflops": 544.1740588961353}, {"key": {"causal": 0, "B": 2, "H": 16, "D": 128, "NQ": 16384, "NK": 8192}, "config": {"BLOCK_SIZE_M": 128, "BLOCK_SIZE_N": 128, "num_warps": 4, "BLOCK_SIZE_M_KV": 64, "BLOCK_SIZE_N_KV": 128, "num_warps_kv": 4, "waves_per_eu": 1, "num_programs_mult": 2, "fused": true, "prefetch_qt": 2, "prefetch_kv": 2, "num_stages": 1}, "ms": 13.521484375, "tflops": 487.8953806915892}, {"key": {"causal": 0, "B": 1, "H": 16, "D": 128, "NQ": 4096, "NK": 16384}, "config": {"BLOCK_SIZE_M": 128, "BLOCK_SIZE_N": 128, "num_warps": 4, "BLOCK_SIZE_M_KV": 64, "BLOCK_SIZE_N_KV": 128, "num_warps_kv": 4, "waves_per_eu": 1, "num_programs_mult": 2, "fused": true, "prefetch_qt": 2, "prefetch_kv": 2, "num_stages": 1}, "ms": 6.770490010579427, "tflops": 243.59646629518528}, {"key": {"causal": 0, "B": 2, "H": 16, "D": 128, "NQ": 16384, "NK": 32768}, "config": {"BLOCK_SIZE_M": 128, "BLOCK_SIZE_N": 128, "num_warps": 4, "BLOCK_SIZE_M_KV": 64, "BLOCK_SIZE_N_KV": 128, "num_warps_kv": 4, "waves_per_eu": 1, "num_programs_mult": 2, "fused": true, "prefetch_qt": 2, "prefetch_kv": 2, "num_stages": 1}, "ms": 47.320027669270836, "tflops": 557.655613624256}, {"key": {"causal": 0, "B": 2, "H": 16, "D": 128, "NQ": 16384, "NK": 16384}, "config": {"BLOCK_SIZE_M": 128, "BLOCK_SIZE_N": 128, "num_warps": 4, "BLOCK_SIZE_M_KV": 64, "BLOCK_SIZE_N_KV": 128, "num_warps_kv": 4, "waves_per_eu": 1, "num_programs_mult": 2, "fused": true, "prefetch_qt": 2, "prefetch_kv": 2, "num_stages": 1}, "ms": 24.281229654947918, "tflops": 543.3884412284433}]