la_configs/bwd_cleaned_smaller_autotune.json
[{"key": {"causal": 0, "B": 16, "H": 16, "D": 128, "NQ": 1024, "NK": 1024}, "config": {"BLOCK_SIZE_M": 64, "BLOCK_SIZE_N": 64, "num_warps": 2, "BLOCK_SIZE_M_KV": 32, "BLOCK_SIZE_N_KV": 64, "num_warps_kv": 2, "waves_per_eu": 1, "num_programs_mult": 3, "fused": true, "prefetch_qt": 2, "prefetch_kv": 2, "num_stages": 1}, "ms": 0.5948156515757242, "tflops": 693.1842820943476}, {"key": {"causal": 0, "B": 8, "H": 16, "D": 128, "NQ": 2048, "NK": 2048}, "config": {"BLOCK_SIZE_M": 64, "BLOCK_SIZE_N": 64, "num_warps": 2, "BLOCK_SIZE_M_KV": 32, "BLOCK_SIZE_N_KV": 64, "num_warps_kv": 2, "waves_per_eu": 1, "num_programs_mult": 2, "fused": true, "prefetch_qt": 2, "prefetch_kv": 2, "num_stages": 1}, "ms": 0.8685949643452963, "tflops": 949.3880976544319}, {"key": {"causal": 0, "B": 4, "H": 16, "D": 128, "NQ": 4096, "NK": 4096}, "config": {"BLOCK_SIZE_M": 64, "BLOCK_SIZE_N": 64, "num_warps": 2, "BLOCK_SIZE_M_KV": 32, "BLOCK_SIZE_N_KV": 64, "num_warps_kv": 2, "waves_per_eu": 1, "num_programs_mult": 2, "fused": true, "prefetch_qt": 2, "prefetch_kv": 2, "num_stages": 1}, "ms": 2.193627675374349, "tflops": 751.8447456597428}, {"key": {"causal": 0, "B": 2, "H": 16, "D": 128, "NQ": 8192, "NK": 8192}, "config": {"BLOCK_SIZE_M": 64, "BLOCK_SIZE_N": 64, "num_warps": 2, "BLOCK_SIZE_M_KV": 32, "BLOCK_SIZE_N_KV": 64, "num_warps_kv": 2, "waves_per_eu": 1, "num_programs_mult": 2, "fused": true, "prefetch_qt": 2, "prefetch_kv": 2, "num_stages": 1}, "ms": 7.970251083374023, "tflops": 413.8558307414878}, {"key": {"causal": 0, "B": 8, "H": 16, "D": 128, "NQ": 1024, "NK": 4096}, "config": {"BLOCK_SIZE_M": 64, "BLOCK_SIZE_N": 64, "num_warps": 2, "BLOCK_SIZE_M_KV": 32, "BLOCK_SIZE_N_KV": 64, "num_warps_kv": 2, "waves_per_eu": 1, "num_programs_mult": 3, "fused": true, "prefetch_qt": 2, "prefetch_kv": 2, "num_stages": 1}, "ms": 0.9081606864929199, "tflops": 908.0262260817749}, {"key": {"causal": 0, "B": 1, "H": 16, "D": 128, "NQ": 4096, "NK": 16384}, "config": {"BLOCK_SIZE_M": 64, "BLOCK_SIZE_N": 64, "num_warps": 2, "BLOCK_SIZE_M_KV": 32, "BLOCK_SIZE_N_KV": 64, "num_warps_kv": 2, "waves_per_eu": 1, "num_programs_mult": 2, "fused": true, "prefetch_qt": 2, "prefetch_kv": 2, "num_stages": 1}, "ms": 7.472633361816406, "tflops": 220.7076624542309}, {"key": {"causal": 0, "B": 2, "H": 48, "D": 128, "NQ": 1024, "NK": 1024}, "config": {"BLOCK_SIZE_M": 64, "BLOCK_SIZE_N": 64, "num_warps": 2, "BLOCK_SIZE_M_KV": 32, "BLOCK_SIZE_N_KV": 64, "num_warps_kv": 2, "waves_per_eu": 1, "num_programs_mult": 2, "fused": true, "prefetch_qt": 2, "prefetch_kv": 2, "num_stages": 1}, "ms": 0.8284156322479248, "tflops": 186.6440185784982}, {"key": {"causal": 0, "B": 2, "H": 48, "D": 128, "NQ": 2048, "NK": 1024}, "config": {"BLOCK_SIZE_M": 64, "BLOCK_SIZE_N": 64, "num_warps": 2, "BLOCK_SIZE_M_KV": 32, "BLOCK_SIZE_N_KV": 64, "num_warps_kv": 2, "waves_per_eu": 1, "num_programs_mult": 3, "fused": true, "prefetch_qt": 2, "prefetch_kv": 2, "num_stages": 1}, "ms": 1.266919692357381, "tflops": 244.08622517864234}, {"key": {"causal": 0, "B": 2, "H": 48, "D": 128, "NQ": 4096, "NK": 8192}, "config": {"BLOCK_SIZE_M": 64, "BLOCK_SIZE_N": 64, "num_warps": 2, "BLOCK_SIZE_M_KV": 32, "BLOCK_SIZE_N_KV": 64, "num_warps_kv": 2, "waves_per_eu": 1, "num_programs_mult": 2, "fused": true, "prefetch_qt": 2, "prefetch_kv": 2, "num_stages": 1}, "ms": 12.195453643798828, "tflops": 405.708755861482}, {"key": {"causal": 0, "B": 2, "H": 48, "D": 128, "NQ": 8192, "NK": 4096}, "config": {"BLOCK_SIZE_M": 64, "BLOCK_SIZE_N": 64, "num_warps": 2, "BLOCK_SIZE_M_KV": 32, "BLOCK_SIZE_N_KV": 64, "num_warps_kv": 2, "waves_per_eu": 1, "num_programs_mult": 2, "fused": true, "prefetch_qt": 2, "prefetch_kv": 2, "num_stages": 1}, "ms": 12.818644205729166, "tflops": 385.98483939359426}]