la_configs/bwd_old_fused_autotune.json
[{"key": {"causal": 0, "B": 16, "H": 16, "D": 128, "NQ": 1024, "NK": 1024}, "config": {"BLOCK_SIZE_M": 64, "BLOCK_SIZE_N": 64, "num_warps": 2, "BLOCK_SIZE_M_KV": 32, "BLOCK_SIZE_N_KV": 64, "num_warps_kv": 2, "waves_per_eu": 1, "num_programs_mult": 2, "fused": true, "prefetch_qt": 2, "prefetch_kv": 2}, "ms": 0.571387529373169, "tflops": 721.6063340904994}, {"key": {"causal": 0, "B": 8, "H": 16, "D": 128, "NQ": 2048, "NK": 2048}, "config": {"BLOCK_SIZE_M": 64, "BLOCK_SIZE_N": 64, "num_warps": 2, "BLOCK_SIZE_M_KV": 32, "BLOCK_SIZE_N_KV": 64, "num_warps_kv": 2, "waves_per_eu": 1, "num_programs_mult": 2, "fused": true, "prefetch_qt": 2, "prefetch_kv": 2}, "ms": 0.8513025045394897, "tflops": 968.6729645862886}, {"key": {"causal": 0, "B": 4, "H": 16, "D": 128, "NQ": 4096, "NK": 4096}, "config": {"BLOCK_SIZE_M": 64, "BLOCK_SIZE_N": 64, "num_warps": 2, "BLOCK_SIZE_M_KV": 32, "BLOCK_SIZE_N_KV": 64, "num_warps_kv": 2, "waves_per_eu": 1, "num_programs_mult": 2, "fused": true, "prefetch_qt": 2, "prefetch_kv": 2}, "ms": 2.1401944160461426, "tflops": 770.6157110300776}, {"key": {"causal": 0, "B": 2, "H": 16, "D": 128, "NQ": 8192, "NK": 8192}, "config": {"BLOCK_SIZE_M": 64, "BLOCK_SIZE_N": 64, "num_warps": 2, "BLOCK_SIZE_M_KV": 32, "BLOCK_SIZE_N_KV": 64, "num_warps_kv": 2, "waves_per_eu": 1, "num_programs_mult": 2, "fused": true, "prefetch_qt": 2, "prefetch_kv": 2}, "ms": 7.889922618865967, "tflops": 418.06935792256274}, {"key": {"causal": 0, "B": 8, "H": 16, "D": 128, "NQ": 1024, "NK": 4096}, "config": {"BLOCK_SIZE_M": 64, "BLOCK_SIZE_N": 64, "num_warps": 2, "BLOCK_SIZE_M_KV": 32, "BLOCK_SIZE_N_KV": 64, "num_warps_kv": 2, "waves_per_eu": 1, "num_programs_mult": 2, "fused": true, "prefetch_qt": 2, "prefetch_kv": 2}, "ms": 0.8507019877433777, "tflops": 969.3567579634697}, {"key": {"causal": 0, "B": 1, "H": 16, "D": 128, "NQ": 4096, "NK": 16384}, "config": {"BLOCK_SIZE_M": 64, "BLOCK_SIZE_N": 64, "num_warps": 2, "BLOCK_SIZE_M_KV": 32, "BLOCK_SIZE_N_KV": 64, "num_warps_kv": 2, "waves_per_eu": 1, "num_programs_mult": 2, "fused": true, "prefetch_qt": 2, "prefetch_kv": 2}, "ms": 7.456299304962158, "tflops": 221.19115317251476}, {"key": {"causal": 0, "B": 2, "H": 48, "D": 128, "NQ": 1024, "NK": 1024}, "config": {"BLOCK_SIZE_M": 64, "BLOCK_SIZE_N": 64, "num_warps": 2, "BLOCK_SIZE_M_KV": 32, "BLOCK_SIZE_N_KV": 64, "num_warps_kv": 2, "waves_per_eu": 1, "num_programs_mult": 2, "fused": true, "prefetch_qt": 2, "prefetch_kv": 2}, "ms": 0.7873479723930359, "tflops": 196.37927330409875}, {"key": {"causal": 0, "B": 2, "H": 48, "D": 128, "NQ": 2048, "NK": 1024}, "config": {"BLOCK_SIZE_M": 64, "BLOCK_SIZE_N": 64, "num_warps": 2, "BLOCK_SIZE_M_KV": 32, "BLOCK_SIZE_N_KV": 64, "num_warps_kv": 2, "waves_per_eu": 1, "num_programs_mult": 2, "fused": true, "prefetch_qt": 2, "prefetch_kv": 2}, "ms": 1.2160634994506836, "tflops": 254.2939948873458}, {"key": {"causal": 0, "B": 2, "H": 48, "D": 128, "NQ": 4096, "NK": 8192}, "config": {"BLOCK_SIZE_M": 64, "BLOCK_SIZE_N": 64, "num_warps": 2, "BLOCK_SIZE_M_KV": 32, "BLOCK_SIZE_N_KV": 64, "num_warps_kv": 2, "waves_per_eu": 1, "num_programs_mult": 2, "fused": true, "prefetch_qt": 2, "prefetch_kv": 2}, "ms": 12.103752136230469, "tflops": 408.7825220892964}, {"key": {"causal": 0, "B": 2, "H": 48, "D": 128, "NQ": 8192, "NK": 4096}, "config": {"BLOCK_SIZE_M": 64, "BLOCK_SIZE_N": 64, "num_warps": 2, "BLOCK_SIZE_M_KV": 32, "BLOCK_SIZE_N_KV": 64, "num_warps_kv": 2, "waves_per_eu": 1, "num_programs_mult": 2, "fused": true, "prefetch_qt": 2, "prefetch_kv": 2}, "ms": 12.707548141479492, "tflops": 389.3593217122328}]