la_configs/bwd_causal_tune.json
[{"key": {"causal": 1, "B": 16, "H": 16, "D": 128, "NQ": 1024, "NK": 1024}, "config": {"BLOCK_SIZE_M": 128, "BLOCK_SIZE_N": 64, "num_warps": 4, "BLOCK_SIZE_M_KV": 64, "BLOCK_SIZE_N_KV": 64, "num_warps_kv": 1, "waves_per_eu": 1, "num_programs_mult": 4, "fused": true, "prefetch_qt": 2, "prefetch_kv": 2, "num_stages": 1}, "ms": 0.5335720181465149, "tflops": 772.7482821312058}, {"key": {"causal": 1, "B": 8, "H": 16, "D": 128, "NQ": 2048, "NK": 2048}, "config": {"BLOCK_SIZE_M": 128, "BLOCK_SIZE_N": 64, "num_warps": 4, "BLOCK_SIZE_M_KV": 64, "BLOCK_SIZE_N_KV": 64, "num_warps_kv": 1, "waves_per_eu": 1, "num_programs_mult": 5, "fused": true, "prefetch_qt": 2, "prefetch_kv": 2, "num_stages": 1}, "ms": 1.044288992881775, "tflops": 789.6604545800836}, {"key": {"causal": 1, "B": 4, "H": 16, "D": 128, "NQ": 4096, "NK": 4096}, "config": {"BLOCK_SIZE_M": 128, "BLOCK_SIZE_N": 64, "num_warps": 4, "BLOCK_SIZE_M_KV": 64, "BLOCK_SIZE_N_KV": 64, "num_warps_kv": 1, "waves_per_eu": 1, "num_programs_mult": 5, "fused": true, "prefetch_qt": 2, "prefetch_kv": 2, "num_stages": 1}, "ms": 3.075524091720581, "tflops": 536.255738039538}, {"key": {"causal": 1, "B": 2, "H": 16, "D": 128, "NQ": 8192, "NK": 8192}, "config": {"BLOCK_SIZE_M": 128, "BLOCK_SIZE_N": 64, "num_warps": 4, "BLOCK_SIZE_M_KV": 64, "BLOCK_SIZE_N_KV": 64, "num_warps_kv": 2, "waves_per_eu": 1, "num_programs_mult": 3, "fused": true, "prefetch_qt": 2, "prefetch_kv": 2, "num_stages": 1}, "ms": 11.076383590698242, "tflops": 297.7989030732064}, {"key": {"causal": 1, "B": 2, "H": 48, "D": 128, "NQ": 1024, "NK": 1024}, "config": {"BLOCK_SIZE_M": 128, "BLOCK_SIZE_N": 64, "num_warps": 4, "BLOCK_SIZE_M_KV": 64, "BLOCK_SIZE_N_KV": 64, "num_warps_kv": 4, "waves_per_eu": 1, "num_programs_mult": 2, "fused": true, "prefetch_qt": 2, "prefetch_kv": 2, "num_stages": 1}, "ms": 0.8314344882965088, "tflops": 185.96633268460153}]