la_configs/bwd_decode_autotune.json
[{"key": {"causal": 0, "B": 16, "H": 16, "D": 128, "NQ": 1024, "NK": 1024}, "config": {"BLOCK_SIZE_M": 128, "BLOCK_SIZE_N": 64, "num_warps": 4, "BLOCK_SIZE_M_KV": 32, "BLOCK_SIZE_N_KV": 128, "num_warps_kv": 4, "waves_per_eu": 1, "num_programs_mult": 3, "fused": true, "prefetch_qt": 2, "prefetch_kv": 2, "num_stages": 1}, "ms": 0.6009929776191711, "tflops": 686.0593647023796}, {"key": {"causal": 0, "B": 8, "H": 16, "D": 128, "NQ": 2048, "NK": 2048}, "config": {"BLOCK_SIZE_M": 128, "BLOCK_SIZE_N": 64, "num_warps": 4, "BLOCK_SIZE_M_KV": 32, "BLOCK_SIZE_N_KV": 128, "num_warps_kv": 4, "waves_per_eu": 1, "num_programs_mult": 1, "fused": true, "prefetch_qt": 2, "prefetch_kv": 2, "num_stages": 1}, "ms": 0.9085705280303955, "tflops": 907.6166300701452}, {"key": {"causal": 0, "B": 4, "H": 16, "D": 128, "NQ": 4096, "NK": 4096}, "config": {"BLOCK_SIZE_M": 128, "BLOCK_SIZE_N": 64, "num_warps": 4, "BLOCK_SIZE_M_KV": 32, "BLOCK_SIZE_N_KV": 128, "num_warps_kv": 2, "waves_per_eu": 1, "num_programs_mult": 3, "fused": true, "prefetch_qt": 2, "prefetch_kv": 2, "num_stages": 1}, "ms": 2.1618130207061768, "tflops": 762.9093847927936}, {"key": {"causal": 0, "B": 2, "H": 16, "D": 128, "NQ": 8192, "NK": 8192}, "config": {"BLOCK_SIZE_M": 128, "BLOCK_SIZE_N": 64, "num_warps": 4, "BLOCK_SIZE_M_KV": 32, "BLOCK_SIZE_N_KV": 128, "num_warps_kv": 2, "waves_per_eu": 1, "num_programs_mult": 3, "fused": true, "prefetch_qt": 2, "prefetch_kv": 2, "num_stages": 1}, "ms": 7.721655368804932, "tflops": 427.17975949223296}, {"key": {"causal": 0, "B": 8, "H": 16, "D": 128, "NQ": 1024, "NK": 4096}, "config": {"BLOCK_SIZE_M": 128, "BLOCK_SIZE_N": 64, "num_warps": 4, "BLOCK_SIZE_M_KV": 32, "BLOCK_SIZE_N_KV": 128, "num_warps_kv": 1, "waves_per_eu": 1, "num_programs_mult": 3, "fused": true, "prefetch_qt": 2, "prefetch_kv": 2, "num_stages": 1}, "ms": 0.9071084856987, "tflops": 909.079491409262}, {"key": {"causal": 0, "B": 1, "H": 16, "D": 128, "NQ": 4096, "NK": 16384}, "config": {"BLOCK_SIZE_M": 128, "BLOCK_SIZE_N": 64, "num_warps": 4, "BLOCK_SIZE_M_KV": 32, "BLOCK_SIZE_N_KV": 128, "num_warps_kv": 2, "waves_per_eu": 1, "num_programs_mult": 3, "fused": true, "prefetch_qt": 2, "prefetch_kv": 2, "num_stages": 1}, "ms": 7.3874993324279785, "tflops": 223.25111210831759}, {"key": {"causal": 0, "B": 2, "H": 48, "D": 128, "NQ": 1024, "NK": 1024}, "config": {"BLOCK_SIZE_M": 128, "BLOCK_SIZE_N": 64, "num_warps": 4, "BLOCK_SIZE_M_KV": 32, "BLOCK_SIZE_N_KV": 128, "num_warps_kv": 2, "waves_per_eu": 1, "num_programs_mult": 2, "fused": true, "prefetch_qt": 2, "prefetch_kv": 2, "num_stages": 1}, "ms": 0.8106244802474976, "tflops": 190.74038154978024}, {"key": {"causal": 0, "B": 2, "H": 48, "D": 128, "NQ": 2048, "NK": 1024}, "config": {"BLOCK_SIZE_M": 128, "BLOCK_SIZE_N": 64, "num_warps": 4, "BLOCK_SIZE_M_KV": 32, "BLOCK_SIZE_N_KV": 128, "num_warps_kv": 1, "waves_per_eu": 1, "num_programs_mult": 3, "fused": true, "prefetch_qt": 2, "prefetch_kv": 2, "num_stages": 1}, "ms": 1.2004640102386475, "tflops": 257.5984308355273}, {"key": {"causal": 0, "B": 2, "H": 48, "D": 128, "NQ": 4096, "NK": 8192}, "config": {"BLOCK_SIZE_M": 128, "BLOCK_SIZE_N": 64, "num_warps": 4, "BLOCK_SIZE_M_KV": 32, "BLOCK_SIZE_N_KV": 128, "num_warps_kv": 2, "waves_per_eu": 1, "num_programs_mult": 3, "fused": true, "prefetch_qt": 2, "prefetch_kv": 2, "num_stages": 1}, "ms": 11.559599876403809, "tflops": 428.0253968904035}, {"key": {"causal": 0, "B": 2, "H": 48, "D": 128, "NQ": 8192, "NK": 4096}, "config": {"BLOCK_SIZE_M": 128, "BLOCK_SIZE_N": 64, "num_warps": 4, "BLOCK_SIZE_M_KV": 32, "BLOCK_SIZE_N_KV": 128, "num_warps_kv": 4, "waves_per_eu": 1, "num_programs_mult": 2, "fused": true, "prefetch_qt": 2, "prefetch_kv": 2, "num_stages": 1}, "ms": 11.82853889465332, "tflops": 418.2936175852186}, {"key": {"causal": 0, "B": 2, "H": 48, "D": 128, "NQ": 128, "NK": 8192}, "config": {"BLOCK_SIZE_M": 128, "BLOCK_SIZE_N": 64, "num_warps": 4, "BLOCK_SIZE_M_KV": 32, "BLOCK_SIZE_N_KV": 128, "num_warps_kv": 2, "waves_per_eu": 1, "num_programs_mult": 3, "fused": true, "prefetch_qt": 2, "prefetch_kv": 2, "num_stages": 1}, "ms": 1.0774215459823608, "tflops": 143.50819624181838}, {"key": {"causal": 0, "B": 2, "H": 48, "D": 128, "NQ": 128, "NK": 4096}, "config": {"BLOCK_SIZE_M": 128, "BLOCK_SIZE_N": 64, "num_warps": 4, "BLOCK_SIZE_M_KV": 32, "BLOCK_SIZE_N_KV": 128, "num_warps_kv": 2, "waves_per_eu": 1, "num_programs_mult": 3, "fused": true, "prefetch_qt": 2, "prefetch_kv": 2, "num_stages": 1}, "ms": 0.6859394907951355, "tflops": 112.70587619672334}, {"key": {"causal": 0, "B": 2, "H": 48, "D": 128, "NQ": 128, "NK": 1024}, "config": {"BLOCK_SIZE_M": 64, "BLOCK_SIZE_N": 64, "num_warps": 2, "BLOCK_SIZE_M_KV": 32, "BLOCK_SIZE_N_KV": 64, "num_warps_kv": 4, "waves_per_eu": 1, "num_programs_mult": 3, "fused": true, "prefetch_qt": 2, "prefetch_kv": 2, "num_stages": 1}, "ms": 0.48443999886512756, "tflops": 39.896277923534775}, {"key": {"causal": 0, "B": 2, "H": 48, "D": 128, "NQ": 128, "NK": 2048}, "config": {"BLOCK_SIZE_M": 128, "BLOCK_SIZE_N": 64, "num_warps": 4, "BLOCK_SIZE_M_KV": 32, "BLOCK_SIZE_N_KV": 128, "num_warps_kv": 4, "waves_per_eu": 1, "num_programs_mult": 3, "fused": true, "prefetch_qt": 2, "prefetch_kv": 2, "num_stages": 1}, "ms": 0.553583025932312, "tflops": 69.82639252513209}]