la_configs/bwd_mon_final_tune.json
[{"key": {"causal": 0, "B": 16, "H": 16, "D": 128, "NQ": 1024, "NK": 1024}, "config": {"BLOCK_SIZE_M": 128, "BLOCK_SIZE_N": 64, "num_warps": 4, "BLOCK_SIZE_M_KV": 32, "BLOCK_SIZE_N_KV": 128, "num_warps_kv": 4, "waves_per_eu": 1, "num_programs_mult": 4, "fused": true, "prefetch_qt": 2, "prefetch_kv": 2, "num_stages": 1}, "ms": 0.6181169748306274, "tflops": 667.0531261966725}, {"key": {"causal": 0, "B": 8, "H": 16, "D": 128, "NQ": 2048, "NK": 2048}, "config": {"BLOCK_SIZE_M": 128, "BLOCK_SIZE_N": 64, "num_warps": 4, "BLOCK_SIZE_M_KV": 32, "BLOCK_SIZE_N_KV": 128, "num_warps_kv": 2, "waves_per_eu": 1, "num_programs_mult": 5, "fused": true, "prefetch_qt": 2, "prefetch_kv": 2, "num_stages": 1}, "ms": 0.9575610160827637, "tflops": 861.1813837257608}, {"key": {"causal": 0, "B": 4, "H": 16, "D": 128, "NQ": 4096, "NK": 4096}, "config": {"BLOCK_SIZE_M": 128, "BLOCK_SIZE_N": 64, "num_warps": 4, "BLOCK_SIZE_M_KV": 32, "BLOCK_SIZE_N_KV": 128, "num_warps_kv": 1, "waves_per_eu": 1, "num_programs_mult": 5, "fused": true, "prefetch_qt": 2, "prefetch_kv": 2, "num_stages": 1}, "ms": 2.2905385494232178, "tflops": 720.0347892329963}, {"key": {"causal": 0, "B": 2, "H": 16, "D": 128, "NQ": 8192, "NK": 8192}, "config": {"BLOCK_SIZE_M": 128, "BLOCK_SIZE_N": 64, "num_warps": 4, "BLOCK_SIZE_M_KV": 32, "BLOCK_SIZE_N_KV": 128, "num_warps_kv": 4, "waves_per_eu": 1, "num_programs_mult": 5, "fused": true, "prefetch_qt": 2, "prefetch_kv": 2, "num_stages": 1}, "ms": 8.344079971313477, "tflops": 395.3143899229388}, {"key": {"causal": 0, "B": 2, "H": 48, "D": 128, "NQ": 1024, "NK": 1024}, "config": {"BLOCK_SIZE_M": 128, "BLOCK_SIZE_N": 64, "num_warps": 4, "BLOCK_SIZE_M_KV": 32, "BLOCK_SIZE_N_KV": 128, "num_warps_kv": 1, "waves_per_eu": 1, "num_programs_mult": 5, "fused": true, "prefetch_qt": 2, "prefetch_kv": 2, "num_stages": 1}, "ms": 0.8631604909896851, "tflops": 179.13102403322088}]