la_configs/tuned_402814.json
[{"key": {"causal": 1, "B": 2, "H": 16, "D": 64, "NQ": 1024, "NK": 1024}, "config": {"BLOCK_SIZE_M": 64, "BLOCK_SIZE_N": 64, "num_warps": 2, "BLOCK_SIZE_M_KV": 64, "BLOCK_SIZE_N_KV": 64, "num_warps_kv": 4, "waves_per_eu": 1, "num_programs_mult": 2}, "ms": 0.2606503963470459, "tflops": 98.86731091591551}, {"key": {"causal": 0, "B": 2, "H": 16, "D": 64, "NQ": 1024, "NK": 1024}, "config": {"BLOCK_SIZE_M": 64, "BLOCK_SIZE_N": 64, "num_warps": 2, "BLOCK_SIZE_M_KV": 64, "BLOCK_SIZE_N_KV": 64, "num_warps_kv": 2, "waves_per_eu": 1, "num_programs_mult": 2}, "ms": 0.3902585983276367, "tflops": 66.0326355048436}, {"key": {"causal": 1, "B": 2, "H": 16, "D": 64, "NQ": 1024, "NK": 2048}, "config": {"BLOCK_SIZE_M": 64, "BLOCK_SIZE_N": 64, "num_warps": 2, "BLOCK_SIZE_M_KV": 64, "BLOCK_SIZE_N_KV": 64, "num_warps_kv": 2, "waves_per_eu": 1, "num_programs_mult": 2}, "ms": 0.2652652025222778, "tflops": 194.29464197314587}, {"key": {"causal": 0, "B": 2, "H": 16, "D": 64, "NQ": 1024, "NK": 2048}, "config": {"BLOCK_SIZE_M": 64, "BLOCK_SIZE_N": 64, "num_warps": 2, "BLOCK_SIZE_M_KV": 64, "BLOCK_SIZE_N_KV": 64, "num_warps_kv": 2, "waves_per_eu": 1, "num_programs_mult": 2}, "ms": 0.4101521968841553, "tflops": 125.65971350034488}, {"key": {"causal": 1, "B": 2, "H": 16, "D": 64, "NQ": 1024, "NK": 4096}, "config": {"BLOCK_SIZE_M": 64, "BLOCK_SIZE_N": 64, "num_warps": 2, "BLOCK_SIZE_M_KV": 64, "BLOCK_SIZE_N_KV": 64, "num_warps_kv": 2, "waves_per_eu": 1, "num_programs_mult": 2}, "ms": 0.32408039569854735, "tflops": 318.06680216436814}, {"key": {"causal": 0, "B": 2, "H": 16, "D": 64, "NQ": 1024, "NK": 4096}, "config": {"BLOCK_SIZE_M": 64, "BLOCK_SIZE_N": 64, "num_warps": 2, "BLOCK_SIZE_M_KV": 32, "BLOCK_SIZE_N_KV": 64, "num_warps_kv": 2, "waves_per_eu": 1, "num_programs_mult": 2}, "ms": 0.5900507926940918, "tflops": 174.69549465962805}, {"key": {"causal": 1, "B": 2, "H": 16, "D": 64, "NQ": 1024, "NK": 8192}, "config": {"BLOCK_SIZE_M": 64, "BLOCK_SIZE_N": 64, "num_warps": 2, "BLOCK_SIZE_M_KV": 64, "BLOCK_SIZE_N_KV": 64, "num_warps_kv": 2, "waves_per_eu": 1, "num_programs_mult": 2}, "ms": 0.5103405952453614, "tflops": 403.96243631938245}, {"key": {"causal": 0, "B": 2, "H": 16, "D": 64, "NQ": 1024, "NK": 8192}, "config": {"BLOCK_SIZE_M": 64, "BLOCK_SIZE_N": 64, "num_warps": 2, "BLOCK_SIZE_M_KV": 64, "BLOCK_SIZE_N_KV": 64, "num_warps_kv": 2, "waves_per_eu": 1, "num_programs_mult": 2}, "ms": 0.8738233566284179, "tflops": 235.92689374137}, {"key": {"causal": 1, "B": 2, "H": 16, "D": 64, "NQ": 2048, "NK": 1024}, "config": {"BLOCK_SIZE_M": 64, "BLOCK_SIZE_N": 64, "num_warps": 2, "BLOCK_SIZE_M_KV": 64, "BLOCK_SIZE_N_KV": 64, "num_warps_kv": 2, "waves_per_eu": 1, "num_programs_mult": 2}, "ms": 0.30272080898284914, "tflops": 170.2545911038445}, {"key": {"causal": 0, "B": 2, "H": 16, "D": 64, "NQ": 2048, "NK": 1024}, "config": {"BLOCK_SIZE_M": 64, "BLOCK_SIZE_N": 64, "num_warps": 2, "BLOCK_SIZE_M_KV": 64, "BLOCK_SIZE_N_KV": 64, "num_warps_kv": 2, "waves_per_eu": 1, "num_programs_mult": 2}, "ms": 0.47911820411682127, "tflops": 107.57179983800683}, {"key": {"causal": 1, "B": 2, "H": 16, "D": 64, "NQ": 2048, "NK": 2048}, "config": {"BLOCK_SIZE_M": 64, "BLOCK_SIZE_N": 64, "num_warps": 2, "BLOCK_SIZE_M_KV": 64, "BLOCK_SIZE_N_KV": 64, "num_warps_kv": 2, "waves_per_eu": 1, "num_programs_mult": 2}, "ms": 0.324152398109436, "tflops": 317.9961515175951}, {"key": {"causal": 0, "B": 2, "H": 16, "D": 64, "NQ": 2048, "NK": 2048}, "config": {"BLOCK_SIZE_M": 64, "BLOCK_SIZE_N": 64, "num_warps": 2, "BLOCK_SIZE_M_KV": 64, "BLOCK_SIZE_N_KV": 64, "num_warps_kv": 2, "waves_per_eu": 1, "num_programs_mult": 2}, "ms": 0.5732979774475098, "tflops": 179.80041646568998}, {"key": {"causal": 1, "B": 2, "H": 16, "D": 64, "NQ": 2048, "NK": 4096}, "config": {"BLOCK_SIZE_M": 64, "BLOCK_SIZE_N": 64, "num_warps": 2, "BLOCK_SIZE_M_KV": 64, "BLOCK_SIZE_N_KV": 64, "num_warps_kv": 2, "waves_per_eu": 1, "num_programs_mult": 2}, "ms": 0.48600039482116697, "tflops": 424.1939562289037}, {"key": {"causal": 0, "B": 2, "H": 16, "D": 64, "NQ": 2048, "NK": 4096}, "config": {"BLOCK_SIZE_M": 64, "BLOCK_SIZE_N": 64, "num_warps": 2, "BLOCK_SIZE_M_KV": 64, "BLOCK_SIZE_N_KV": 64, "num_warps_kv": 2, "waves_per_eu": 1, "num_programs_mult": 2}, "ms": 0.8449565887451171, "tflops": 243.98700827243104}, {"key": {"causal": 1, "B": 2, "H": 16, "D": 64, "NQ": 2048, "NK": 8192}, "config": {"BLOCK_SIZE_M": 64, "BLOCK_SIZE_N": 64, "num_warps": 2, "BLOCK_SIZE_M_KV": 64, "BLOCK_SIZE_N_KV": 64, "num_warps_kv": 2, "waves_per_eu": 1, "num_programs_mult": 2}, "ms": 0.8327546119689941, "tflops": 495.12407915832927}, {"key": {"causal": 0, "B": 2, "H": 16, "D": 64, "NQ": 2048, "NK": 8192}, "config": {"BLOCK_SIZE_M": 64, "BLOCK_SIZE_N": 64, "num_warps": 2, "BLOCK_SIZE_M_KV": 64, "BLOCK_SIZE_N_KV": 64, "num_warps_kv": 2, "waves_per_eu": 1, "num_programs_mult": 2}, "ms": 1.4211790084838867, "tflops": 290.1231005767947}, {"key": {"causal": 1, "B": 2, "H": 16, "D": 64, "NQ": 4096, "NK": 1024}, "config": {"BLOCK_SIZE_M": 64, "BLOCK_SIZE_N": 64, "num_warps": 2, "BLOCK_SIZE_M_KV": 64, "BLOCK_SIZE_N_KV": 64, "num_warps_kv": 2, "waves_per_eu": 1, "num_programs_mult": 2}, "ms": 0.4388026237487793, "tflops": 234.91020683370917}, {"key": {"causal": 0, "B": 2, "H": 16, "D": 64, "NQ": 4096, "NK": 1024}, "config": {"BLOCK_SIZE_M": 64, "BLOCK_SIZE_N": 64, "num_warps": 2, "BLOCK_SIZE_M_KV": 64, "BLOCK_SIZE_N_KV": 64, "num_warps_kv": 2, "waves_per_eu": 1, "num_programs_mult": 2}, "ms": 0.670850419998169, "tflops": 153.6545435930134}, {"key": {"causal": 1, "B": 2, "H": 16, "D": 64, "NQ": 4096, "NK": 2048}, "config": {"BLOCK_SIZE_M": 64, "BLOCK_SIZE_N": 64, "num_warps": 2, "BLOCK_SIZE_M_KV": 64, "BLOCK_SIZE_N_KV": 64, "num_warps_kv": 2, "waves_per_eu": 1, "num_programs_mult": 2}, "ms": 0.44852099418640134, "tflops": 459.64053607337365}, {"key": {"causal": 0, "B": 2, "H": 16, "D": 64, "NQ": 4096, "NK": 2048}, "config": {"BLOCK_SIZE_M": 64, "BLOCK_SIZE_N": 64, "num_warps": 2, "BLOCK_SIZE_M_KV": 64, "BLOCK_SIZE_N_KV": 64, "num_warps_kv": 2, "waves_per_eu": 1, "num_programs_mult": 2}, "ms": 0.8477689743041992, "tflops": 243.17760670258446}]